<?xml version="1.0" encoding="utf-8"?>
<ruleset xmlns="http://bitvunit.codescape.de/ruleset/1.0" xmlns:xsi="http://www.w3.org/2001/XMLSchema-instance"
         xsi:schemaLocation="http://bitvunit.codescape.de/ruleset/1.0 ../ruleset-schema.xsd">

    <description>Set of all rules used to demo custom rule sets.</description>

    <rule class="de.codescape.bitvunit.rule.forms.LabelContainsTextRule"/>
    <rule class="de.codescape.bitvunit.rule.forms.LabelForInputFieldRule"/>
    <rule class="de.codescape.bitvunit.rule.forms.LabelForSelectTagRule"/>
    <rule class="de.codescape.bitvunit.rule.forms.LabelForTextareaRule"/>
    <rule class="de.codescape.bitvunit.rule.forms.LabelWithoutFormElementRule"/>
    <rule class="de.codescape.bitvunit.rule.forms.UniqueLabelForFormElementRule"/>

</ruleset>